### ISSUE TITLE
Workers load balancer is down on GCP - fresh installation

### ISSUE THREAD

**Issue by llomgui** [openshift/okd#732]
**Describe the bug**

I tried many times to install OKD 4.7 on GCP. But it doesn't work.
Each time, masters load balancer is up, but workers load balancer is down.

**Version**

Fedora coreos: projects/fedora-coreos-cloud/global/images/fedora-coreos-33-20210217-3-0-gcp-x86-64

I tested with the latest: 4.7.0-0.okd-2021-06-19-191547
And 4.7.0-0.okd-2021-04-24-103438

The difference between them are GCP images (gcp-machine-controllers, gcp-pd-csi-driver, gcp-pd-csi-driver-operator)

**How reproducible**

You can try to install a cluster with the versions above.

**Log bundle**

Tcpdump on workers (35.191.0.0/16 is one of healthcheck ip ranges) :

⬢[root@toolbox ~]# tcpdump net 35.191.0.0/16
dropped privs to tcpdump
tcpdump: verbose output suppressed, use -v[v]... for full protocol decode
listening on ens4, link-type EN10MB (Ethernet), snapshot length 262144 bytes
08:24:57.870853 IP 93-9-191-35.1e100.net.56282 > 10.69.18.29.31947: Flags [S], seq 2878974984, win 65535, options [mss 1420,sackOK,TS val 3319591662 ecr 0,nop,wscale 8], length 0
08:24:57.870886 IP 93-9-191-35.1e100.net.56282 > 10.69.18.29.31947: Flags [S], seq 2878974984, win 65535, options [mss 1420,sackOK,TS val 3319591662 ecr 0,nop,wscale 8], length 0
08:24:58.970867 IP 91-9-191-35.1e100.net.49926 > 10.69.18.29.31947: Flags [S], seq 2200351049, win 65535, options [mss 1420,sackOK,TS val 1361109183 ecr 0,nop,wscale 8], length 0
08:24:58.970900 IP 91-9-191-35.1e100.net.49926 > 10.69.18.29.31947: Flags [S], seq 2200351049, win 65535, options [mss 1420,sackOK,TS val 1361109183 ecr 0,nop,wscale 8], length 0
08:24:59.231184 IP 89-9-191-35.1e100.net.51776 > 10.69.18.29.31947: Flags [S], seq 2492519718, win 65535, options [mss 1420,sackOK,TS val 1719082114 ecr 0,nop,wscale 8], length 0
08:24:59.231205 IP 89-9-191-35.1e100.net.51776 > 10.69.18.29.31947: Flags [S], seq 2492519718, win 65535, options [mss 1420,sackOK,TS val 1719082114 ecr 0,nop,wscale 8], length 0
08:25:05.871865 IP 93-9-191-35.1e100.net.46610 > 10.69.18.29.31947: Flags [S], seq 3336617057, win 65535, options [mss 1420,sackOK,TS val 3319599663 ecr 0,nop,wscale 8], length 0
08:25:05.871911 IP 93-9-191-35.1e100.net.46610 > 10.69.18.29.31947: Flags [S], seq 3336617057, win 65535, options [mss 1420,sackOK,TS val 3319599663 ecr 0,nop,wscale 8], length 0
08:25:06.972166 IP 91-9-191-35.1e100.net.42364 > 10.69.18.29.31947: Flags [S], seq 2659682155, win 65535, options [mss 1420,sackOK,TS val 1361117184 ecr 0,nop,wscale 8], length 0
08:25:06.972213 IP 91-9-191-35.1e100.net.42364 > 10.69.18.29.31947: Flags [S], seq 2659682155, win 65535, options [mss 1420,sackOK,TS val 1361117184 ecr 0,nop,wscale 8], length 0
08:25:07.232678 IP 89-9-191-35.1e100.net.52286 > 10.69.18.29.31947: Flags [S], seq 2445915522, win 65535, options [mss 1420,sackOK,TS val 1719090116 ecr 0,nop,wscale 8], length 0
08:25:07.232704 IP 89-9-191-35.1e100.net.52286 > 10.69.18.29.31947: Flags [S], seq 2445915522, win 65535, options [mss 1420,sackOK,TS val 1719090116 ecr 0,nop,wscale 8], length 0

As you can see, I only get SYN, it never answers.

Same command on one of masters:

⬢[root@toolbox ~]# tcpdump net 35.191.0.0/16
dropped privs to tcpdump
tcpdump: verbose output suppressed, use -v[v]... for full protocol decode
listening on ens4, link-type EN10MB (Ethernet), snapshot length 262144 bytes
08:27:51.264928 IP 27-0-191-35.1e100.net.60690 > 10.69.18.24.sun-sr-https: Flags [S], seq 2753378919, win 65535, options [mss 1420,sackOK,TS val 3835801912 ecr 0,nop,wscale 8], length 0
08:27:51.264996 IP 10.69.18.24.sun-sr-https > 27-0-191-35.1e100.net.60690: Flags [S.], seq 722652261, ack 2753378920, win 64768, options [mss 1420,sackOK,TS val 3241567184 ecr 3835801912,nop,wscale 7], length 0
08:27:51.265121 IP 27-0-191-35.1e100.net.60690 > 10.69.18.24.sun-sr-https: Flags [.], ack 1, win 256, options [nop,nop,TS val 3835801912 ecr 3241567184], length 0
08:27:51.265230 IP 27-0-191-35.1e100.net.60690 > 10.69.18.24.sun-sr-https: Flags [P.], seq 1:255, ack 1, win 256, options [nop,nop,TS val 3835801913 ecr 3241567184], length 254
08:27:51.265243 IP 10.69.18.24.sun-sr-https > 27-0-191-35.1e100.net.60690: Flags [.], ack 255, win 505, options [nop,nop,TS val 3241567184 ecr 3835801913], length 0
08:27:51.268662 IP 10.69.18.24.sun-sr-https > 27-0-191-35.1e100.net.60690: Flags [P.], seq 1:3021, ack 255, win 505, options [nop,nop,TS val 3241567188 ecr 3835801913], length 3020
08:27:51.268856 IP 27-0-191-35.1e100.net.60690 > 10.69.18.24.sun-sr-https: Flags [.], ack 3021, win 280, options [nop,nop,TS val 3835801916 ecr 3241567188], length 0
08:27:51.269035 IP 27-0-191-35.1e100.net.60690 > 10.69.18.24.sun-sr-https: Flags [P.], seq 255:327, ack 3021, win 280, options [nop,nop,TS val 3835801916 ecr 3241567188], length 72
08:27:51.269050 IP 10.69.18.24.sun-sr-https > 27-0-191-35.1e100.net.60690: Flags [.], ack 327, win 505, options [nop,nop,TS val 3241567188 ecr 3835801916], length 0
08:27:51.269150 IP 27-0-191-35.1e100.net.60690 > 10.69.18.24.sun-sr-https: Flags [P.], seq 327:442, ack 3021, win 280, options [nop,nop,TS val 3835801916 ecr 3241567188], length 115
08:27:51.269161 IP 10.69.18.24.sun-sr-https > 27-0-191-35.1e100.net.60690: Flags [.], ack 442, win 505, options [nop,nop,TS val 3241567188 ecr 3835801916], length 0

It works as expected.

**Comment by LucaPrete** [comment]
Just to echo what @llomgui is saying,

As you can see, workers seem to only receive SYN packets from the health checks, but they don't generate outgoing packets, letting us think the machine is dropping those packets.

**Comment by vrutkovs** [comment]
Please attach [log bundle](https://docs.okd.io/latest/installing/installing-troubleshooting.html#installation-bootstrap-gather_installing-troubleshooting)
